{
  "schema_version": "1.0",
  "generated_at": "2026-08-08T12:00:00",
  "git_commit": "abc123",
  "worktree_status": "test fixture: all pass with verified evidence",
  "packages": [
    {"id": "WP1", "name": "盘点", "final_status": "PASS", "blocking_findings": 0, "notes": "", "tests_executed": true},
    {"id": "WP2", "name": "日常业务", "final_status": "PASS", "blocking_findings": 0, "notes": "已执行", "tests_executed": true, "execution_report": "quality/release_gate/tests/fixtures/evidence_files/wp2_execution_report.csv"},
    {"id": "WP3", "name": "资料行政", "final_status": "PASS", "blocking_findings": 0, "notes": "已执行", "tests_executed": true, "execution_report": "quality/release_gate/tests/fixtures/evidence_files/wp3_execution_report.csv"},
    {"id": "WP4", "name": "技术运维", "final_status": "PASS", "blocking_findings": 0, "notes": "已执行", "tests_executed": true, "execution_report": "quality/release_gate/tests/fixtures/evidence_files/wp4_execution_report.csv"},
    {"id": "WP5", "name": "租户隔离", "final_status": "PASS", "blocking_findings": 0, "notes": "已修复", "tests_executed": true},
    {"id": "WP6", "name": "权限审计", "final_status": "PASS", "blocking_findings": 0, "notes": "报告已生成", "artifacts_complete": true, "tests_executed": true},
    {"id": "WP7", "name": "数据库审计", "final_status": "PASS", "blocking_findings": 0, "notes": "已执行", "tests_executed": true, "execution_report": "quality/release_gate/tests/fixtures/evidence_files/wp7_execution_report.csv"},
    {"id": "WP8", "name": "E2E", "final_status": "PASS", "blocking_findings": 0, "notes": "已执行，无泄露", "tests_executed": true},
    {"id": "WP9", "name": "性能灾备", "final_status": "PASS", "blocking_findings": 0, "notes": "负载和恢复已执行", "tests_executed": true}
  ],
  "confirmed_findings": [],
  "secret_findings": [],
  "verified_test_results": {
    "total_historical_claimed": "500",
    "total_verified_executed": 500,
    "verification_method": "structural"
  },
  "blocked_checks": [],
  "missing_artifacts": [],
  "evidence": {
    "permission_audit": {
      "status": "PASS",
      "report_paths": ["quality/release_gate/tests/fixtures/evidence_files/permission_catalog.csv"],
      "generated_at": "2026-08-08T12:00:00"
    },
    "performance_load": {
      "status": "PASS",
      "result_path": "quality/release_gate/tests/fixtures/evidence_files/load_test_results.csv",
      "executed_at": "2026-08-08T12:00:00",
      "environment": "isolated_test_db"
    },
    "disaster_recovery_restore": {
      "status": "PASS",
      "drill_report": "quality/release_gate/tests/fixtures/evidence_files/restore_drill_results.csv",
      "restored_at": "2026-08-08T12:00:00",
      "environment": "isolated_restore_env"
    }
  }
}
