{
  "schema_version": "1.0",
  "generated_at": "2026-08-08T12:00:00",
  "git_commit": "abc123",
  "worktree_status": "test fixture: CRITICAL with remediation_status=not fixed",
  "packages": [
    {"id": "WP1", "name": "WP1", "final_status": "PASS", "blocking_findings": 0, "notes": "", "tests_executed": true},
    {"id": "WP2", "name": "WP2", "final_status": "PASS", "blocking_findings": 0, "notes": "", "tests_executed": true, "execution_report": "quality/release_gate/tests/fixtures/evidence_files/wp2_execution_report.csv"},
    {"id": "WP3", "name": "WP3", "final_status": "PASS", "blocking_findings": 0, "notes": "", "tests_executed": true, "execution_report": "quality/release_gate/tests/fixtures/evidence_files/wp3_execution_report.csv"},
    {"id": "WP4", "name": "WP4", "final_status": "PASS", "blocking_findings": 0, "notes": "", "tests_executed": true, "execution_report": "quality/release_gate/tests/fixtures/evidence_files/wp4_execution_report.csv"},
    {"id": "WP5", "name": "WP5", "final_status": "PASS", "blocking_findings": 0, "notes": "", "tests_executed": true},
    {"id": "WP6", "name": "WP6", "final_status": "PASS", "blocking_findings": 0, "notes": "", "artifacts_complete": true, "tests_executed": true},
    {"id": "WP7", "name": "WP7", "final_status": "PASS", "blocking_findings": 0, "notes": "", "tests_executed": true, "execution_report": "quality/release_gate/tests/fixtures/evidence_files/wp7_execution_report.csv"},
    {"id": "WP8", "name": "WP8", "final_status": "PASS", "blocking_findings": 0, "notes": "", "tests_executed": true},
    {"id": "WP9", "name": "WP9", "final_status": "PASS", "blocking_findings": 0, "notes": "", "tests_executed": true}
  ],
  "confirmed_findings": [
    {"id": "F-001", "severity": "CRITICAL", "title": "Critical with not fixed status", "package": "WP5", "blocking": false, "remediation_status": "not fixed"}
  ],
  "secret_findings": [],
  "verified_test_results": {"total_verified_executed": 500},
  "blocked_checks": [],
  "missing_artifacts": [],
  "evidence": {
    "permission_audit": {"status": "PASS", "report_paths": ["quality/release_gate/tests/fixtures/evidence_files/permission_catalog.csv"], "generated_at": "2026-08-08T12:00:00"},
    "performance_load": {"status": "PASS", "result_path": "quality/release_gate/tests/fixtures/evidence_files/load_test_results.csv", "executed_at": "2026-08-08T12:00:00", "environment": "isolated_test_db"},
    "disaster_recovery_restore": {"status": "PASS", "drill_report": "quality/release_gate/tests/fixtures/evidence_files/restore_drill_results.csv", "restored_at": "2026-08-08T12:00:00", "environment": "isolated_restore_env"}
  }
}
